{
  "schema": "agenomic.prompt_version/v1",
  "workspace_id": "0b6c2f1e-7a44-4c8e-9f1d-2a3b4c5d6e7f",
  "prompt_id": "prm_greeting",
  "version": 1,
  "prompt_kind": "text",
  "content_digest": "sha256:bcd8fd23d76935d3eb9d1afb1e821ecebbf0ccb0f3655b5776ec8eacbe6a5ff1",
  "content": {
    "schema": "agenomic.prompt_content/v1",
    "template_format": "agenomic-fstring/v1",
    "renderer_version": "1",
    "kind": "text",
    "body": "Hello {name}",
    "variables": {
      "name": {
        "type": "string",
        "required": true
      }
    },
    "partials": {},
    "output_contract": null,
    "fragments": {}
  },
  "metadata": {
    "parent_version": null,
    "change_message": "First version",
    "author": {
      "user_id": "5d0b0e7c-3c1a-4b0e-9d77-1f2e3a4b5c6d",
      "api_key_id": null
    },
    "created_at": "2026-10-04T20:40:13Z",
    "variable_descriptions": {
      "name": "The name of the person to greet."
    },
    "provenance": {
      "source": "editor",
      "draft_revision": 12,
      "import_id": null,
      "item_id": null,
      "source_file": null,
      "source_line": null
    }
  }
}
